{
  "compounds": [
    {
      "molecules": [
        "com.github.haexmas.atoms.spaex-constitution"
      ],
      "revision": "22b887128703b2572248eb40cf72aff1f99ba458",
      "source": "https://github.com/haexmas/atoms"
    }
  ],
  "identity": "com.github.haexmas.spaex",
  "spaex_min_version": ">=4.0.0",
  "spaex_version": "4"
}
